[
  {
    "id": 1,
    "date_pluie": "2026-10-04",
    "pluie_mm": 111,
    "station": "Keur Massar",
    "date_image": "2026-10-06",
    "eau_geojson": {
      "type": "FeatureCollection",
      "features": [
        {
          "type": "Feature",
          "properties": {},
          "geometry": {
            "type": "Polygon",
            "coordinates": [
              [
                [
                  -17.289067,
                  14.781
                ],
                [
                  -17.2905,
                  14.7818
                ],
                [
                  -17.291933,
                  14.781
                ],
                [
                  -17.291933,
                  14.7794
                ],
                [
                  -17.2905,
                  14.7786
                ],
                [
                  -17.289067,
                  14.7794
                ],
                [
                  -17.289067,
                  14.781
                ]
              ]
            ]
          }
        },
        {
          "type": "Feature",
          "properties": {},
          "geometry": {
            "type": "Polygon",
            "coordinates": [
              [
                [
                  -17.303367,
                  14.7906
                ],
                [
                  -17.3048,
                  14.7914
                ],
                [
                  -17.306233,
                  14.7906
                ],
                [
                  -17.306233,
                  14.789
                ],
                [
                  -17.3048,
                  14.7882
                ],
                [
                  -17.303367,
                  14.789
                ],
                [
                  -17.303367,
                  14.7906
                ]
              ]
            ]
          }
        }
      ]
    }
  },
  {
    "id": 2,
    "date_pluie": "2025-08-15",
    "pluie_mm": null,
    "station": "CHIRPS",
    "date_image": null,
    "eau_geojson": null
  }
]